{
  "templateId": "prompt_044",
  "name": "prompt_044",
  "sourceFile": "prompt_044.html",
  "renderMode": "semantic",
  "regions": [
    {
      "name": "header",
      "placement": "main",
      "origins": []
    }
  ],
  "blocks": [
    {
      "type": "summary",
      "selector": "[data-section='summary']",
      "placement": "main"
    },
    {
      "type": "experience",
      "selector": "[data-section='experience']",
      "placement": "main"
    },
    {
      "type": "education",
      "selector": "[data-section='education']",
      "placement": "main"
    },
    {
      "type": "skills",
      "selector": "[data-section='skills']",
      "placement": "main"
    },
    {
      "type": "projects",
      "selector": "[data-section='projects']",
      "placement": "main"
    }
  ],
  "theme": [
    {
      "key": "--color-primary",
      "default": "#4F46E5",
      "control": "color"
    },
    {
      "key": "--color-background",
      "default": "#FFFFFF",
      "control": "color"
    },
    {
      "key": "--color-text",
      "default": "#1A1A1A",
      "control": "color"
    },
    {
      "key": "--font-heading",
      "default": "sans-serif",
      "control": "font"
    },
    {
      "key": "--font-body",
      "default": "sans-serif",
      "control": "font"
    },
    {
      "key": "--font-size-base",
      "default": "12pt",
      "control": "number"
    },
    {
      "key": "--page-margin",
      "default": "48px",
      "control": "number"
    },
    {
      "key": "--section-gap",
      "default": "16px",
      "control": "number"
    }
  ],
  "sampleData": {
    "name": "苏轼",
    "summary": "应届新媒体运营实践者，擅长以数据驱动内容策略。在校园IP孵化与品牌社交传播中累计增粉3.2万，具备短视频脚本、图文排版及社群活跃管理经验。追求莫兰迪美学的视觉叙事，致力于创造有温度的连接。"
  },
  "customFields": []
}